{
  "schema_version": 1,
  "policy_version": "quality-v1",
  "timestamp_future_tolerance_ms": 1000,
  "stale_event_threshold_ms": 60000,
  "reject_duplicate_raw_event": true,
  "reject_sequence_regression": true,
  "reject_crossed_book": true,
  "event_contract_price_min": 0,
  "event_contract_price_max": 1
}
